{
  "schema_version": "xinao.provider_egress_engineering_canary_receipt.v1",
  "status": "observed",
  "path_class": "engineering_canary",
  "real_provider_call": true,
  "provider_effect_verified": true,
  "requested_model": "grok-4.5",
  "observed_backend_model": "grok-4.5-build",
  "stop_reason": "EndTurn",
  "output_tokens": 4,
  "usage_accounting_complete": true,
  "usage": {
    "input_tokens": 12,
    "output_tokens": 4,
    "total_tokens": 16
  },
  "endpoint_host": "cli-chat-proxy.grok.com",
  "internal_network_id": "net_aaaaaaaaaaaaaaaa",
  "proxy_container_id": "ctr_bbbbbbbbbbbbbbbb",
  "proxy_image_id": "sha256:cccccccccccccccccccccccccccccccccccccccccccccccccccccccccccccccc",
  "allowlist_sha256": "dddddddddddddddddddddddddddddddddddddddddddddddddddddddddddddddd",
  "proxy_config_sha256": "eeeeeeeeeeeeeeeeeeeeeeeeeeeeeeeeeeeeeeeeeeeeeeeeeeeeeeeeeeeeeeee",
  "canary_image_id": "sha256:ffffffffffffffffffffffffffffffffffffffffffffffffffffffffffffffff",
  "internal_network_only": true,
  "auth_mounted_read_only": true,
  "auth_content_persisted": false,
  "raw_output_persisted": false,
  "research_invoked": false,
  "is_research_call": false,
  "scientific_research": false,
  "masquerades_as_research": false,
  "scientific_adoption": false,
  "science_restored": false,
  "parent_complete": false,
  "authority": false,
  "completion_claim_allowed": false,
  "secrets_present": false,
  "provider_egress_runtime_verified": false,
  "provider_egress_live_verified": false,
  "observed_at": "2026-07-30T08:00:00.000Z",
  "connect_only": false,
  "http_only": false
}
